{"$schema":"https://json-schema.org/draft/2020-12/schema","$id":"https://vexil-lang.org/release/controls/observations/current-go-runtime-release-controls-2026-07-26.json","observationSchema":"https://vexil-lang.org/release/schemas/external-observation.schema.json","version":"1.0","recordId":"ECO-2026-07-26-GO-RUNTIME-RELEASE-CONTROLS","evidenceState":"current","provider":"github","scope":"vexil-lang/vexil","observedAtUtc":"2026-07-26T20:46:10Z","collection":{"mode":"read-only","providerInterface":"GitHub REST API through GitHub CLI GET requests","credentialMode":"owner-authorized-write-capable-read-only","mutationGuard":"GET-only; auto-remediation and provider writes are rejected before collection","credentialAuthorization":{"status":"explicit-owner-authorized-procedural-audit-exception","authorizedBy":"github:furkanmamuk","authorizationReference":"Repository Administrator direction in this release-recovery session on 2026-07-26","leastPrivilegeEnforced":false,"allowedOperations":"GET only"}},"stableIdentity":{"normalizedStateDigest":"sha256:a2168dfb7eae1a9066e752b18e9d019ef7d37cbce9ef489e6785f9fef0f75c2b","responseDigest":"sha256:a2168dfb7eae1a9066e752b18e9d019ef7d37cbce9ef489e6785f9fef0f75c2b","collectionTimestampExcluded":true},"results":[{"assertionId":"EC-004","query":{"method":"GET","path":"/repos/vexil-lang/vexil/environments/{release-target}"},"status":"compliant","observedValue":"release-go-runtime has github:furkanmamuk as reviewer, allows the sole-maintainer self-review exception, denies administrator bypass, and restricts deployments to protected branches.","diagnostic":"This is a target-isolated human gate, not independent review or publishing authority.","evidenceReference":"GET /repos/vexil-lang/vexil/environments/release-go-runtime; response sha256:a2168dfb7eae1a9066e752b18e9d019ef7d37cbce9ef489e6785f9fef0f75c2b"}],"publicationReadiness":"blocked"}
